{
  "$schema": "https://json-schema.org/draft/2020-12/schema",
  "$id": "https://codellm-devkit.github.io/schema/v2/iac/analysis.schema.json",
  "title": "codeanalyzer-iac schema v2 analysis output",
  "x-cldk": {
    "schemaVersion": "2.0.0",
    "language": "iac",
    "source": {
      "repo": "codellm-devkit/codeanalyzer-iac",
      "release": "v0.1.0",
      "definedIn": "internal/model"
    }
  },
  "$ref": "#/$defs/Analysis",
  "$defs": {
    "Analysis": {
      "type": "object",
      "additionalProperties": false,
      "required": ["schema_version", "language", "max_level", "analyzer", "application"],
      "properties": {
        "schema_version": {"const": "2.0.0"},
        "language": {"const": "iac"},
        "max_level": {"type": "integer", "minimum": 1, "maximum": 3},
        "analyzer": {"$ref": "#/$defs/Analyzer"},
        "application": {"$ref": "#/$defs/Application"}
      }
    },
    "Analyzer": {
      "type": "object",
      "additionalProperties": false,
      "required": ["name", "version"],
      "properties": {
        "name": {"const": "codeanalyzer-iac"},
        "version": {"type": "string", "minLength": 1}
      }
    },
    "Application": {
      "type": "object",
      "additionalProperties": false,
      "required": [
        "id",
        "kind",
        "artifacts",
        "packages",
        "external_chart_references",
        "kubernetes_resource_addresses",
        "diagnostics",
        "edges"
      ],
      "properties": {
        "id": {"type": "string", "pattern": "^can://iac/[^/]+$"},
        "kind": {"const": "application"},
        "artifacts": {
          "type": "object",
          "additionalProperties": {"$ref": "#/$defs/Artifact"}
        },
        "packages": {
          "type": "object",
          "additionalProperties": {"$ref": "#/$defs/Package"}
        },
        "external_chart_references": {
          "type": "object",
          "additionalProperties": {"$ref": "#/$defs/HelmChartReference"}
        },
        "kubernetes_resource_addresses": {
          "type": "object",
          "additionalProperties": {"$ref": "#/$defs/KubernetesResourceAddress"}
        },
        "diagnostics": {
          "type": "object",
          "additionalProperties": {"$ref": "#/$defs/Diagnostic"}
        },
        "edges": {
          "type": "object",
          "additionalProperties": {"$ref": "#/$defs/Edge"}
        }
      }
    },
    "Artifact": {
      "type": "object",
      "additionalProperties": false,
      "required": ["id", "kind", "path", "format", "source", "sha256", "size_bytes", "config_keys", "aliases"],
      "properties": {
        "id": {"type": "string", "pattern": "^can://artifact/(?:[A-Za-z0-9._~-]|%[0-9A-Fa-f]{2})+/(?:[A-Za-z0-9._~-]|%[0-9A-Fa-f]{2})+(?:/(?:[A-Za-z0-9._~-]|%[0-9A-Fa-f]{2})+)*$"},
        "kind": {"const": "artifact"},
        "path": {
          "type": "string",
          "pattern": "^(?!/)(?!.*(?:^|/)\\.{1,2}(?:/|$))[^\\\\]+$"
        },
        "format": {"type": "string", "minLength": 1},
        "source": {"type": "string"},
        "sha256": {"type": "string", "pattern": "^[0-9a-f]{64}$"},
        "size_bytes": {"type": "integer", "minimum": 0},
        "config_keys": {
          "type": "object",
          "additionalProperties": {"$ref": "#/$defs/ConfigKey"}
        },
        "aliases": {
          "type": "array",
          "items": {"$ref": "#/$defs/IdentityAlias"}
        },
        "iac": {"$ref": "#/$defs/IaCFacet"},
        "codeanalyzer_iac_config": {"$ref": "#/$defs/CodeAnalyzerIaCConfig"}
      }
    },
    "Span": {
      "type": "object",
      "additionalProperties": false,
      "required": ["start", "end", "bytes"],
      "properties": {
        "start": {
          "type": "array",
          "minItems": 2,
          "maxItems": 2,
          "items": {"type": "integer", "minimum": 1}
        },
        "end": {
          "type": "array",
          "minItems": 2,
          "maxItems": 2,
          "items": {"type": "integer", "minimum": 1}
        },
        "bytes": {
          "type": "array",
          "minItems": 2,
          "maxItems": 2,
          "items": {"type": "integer", "minimum": 0}
        }
      }
    },
    "ConfigKey": {
      "type": "object",
      "additionalProperties": false,
      "required": ["id", "kind", "name", "path", "span"],
      "properties": {
        "id": {"type": "string", "pattern": "^can://iac/"},
        "kind": {"const": "config_key"},
        "name": {"type": "string", "minLength": 1},
        "path": {"type": "string", "minLength": 1},
        "span": {"$ref": "#/$defs/Span"},
        "iac": {"$ref": "#/$defs/HelmValueFacet"}
      }
    },
    "IdentityAlias": {
      "type": "object",
      "additionalProperties": false,
      "required": ["id", "kind", "target"],
      "properties": {
        "id": {"type": "string", "pattern": "^can://iac/"},
        "kind": {"type": "string", "minLength": 1},
        "target": {"type": "string", "pattern": "^can://(artifact|iac)/"}
      }
    },
    "Diagnostic": {
      "type": "object",
      "additionalProperties": false,
      "required": ["id", "kind", "severity", "code", "message"],
      "properties": {
        "id": {"type": "string", "pattern": "^can://iac/"},
        "kind": {"const": "diagnostic"},
        "severity": {"enum": ["info", "warning", "error"]},
        "code": {"type": "string", "minLength": 1},
        "message": {"type": "string", "minLength": 1},
        "phase": {"enum": ["load", "dependency", "values", "template", "decode"]},
        "artifact_id": {"type": "string", "pattern": "^can://artifact/"},
        "span": {"$ref": "#/$defs/Span"}
      }
    },
    "Package": {
      "type": "object",
      "additionalProperties": false,
      "required": ["id", "kind", "purl"],
      "properties": {
        "id": {"type": "string", "pattern": "^pkg:[a-z][a-z0-9.+-]*/.+"},
        "kind": {"const": "package"},
        "purl": {"type": "string", "pattern": "^pkg:[a-z][a-z0-9.+-]*/.+"}
      }
    },
    "Edge": {
      "type": "object",
      "additionalProperties": false,
      "required": ["src", "dst"],
      "properties": {
        "src": {"type": "string", "minLength": 1},
        "dst": {"type": "string", "minLength": 1}
      }
    },
    "IaCFacet": {
      "oneOf": [
        {"$ref": "#/$defs/HelmChart"}
      ]
    },
    "HelmChart": {
      "type": "object",
      "additionalProperties": false,
      "required": ["dialect", "kind", "status", "api_version", "name", "version", "dependencies", "renders"],
      "properties": {
        "dialect": {"const": "helm"},
        "kind": {"const": "helm_chart"},
        "status": {"enum": ["complete", "partial", "failed"]},
        "api_version": {"enum": ["v1", "v2"]},
        "name": {"type": "string", "minLength": 1},
        "version": {"type": "string", "minLength": 1},
        "kube_version": {"type": "string"},
        "description": {"type": "string"},
        "chart_type": {"enum": ["application", "library"]},
        "keywords": {"type": "array", "items": {"type": "string"}},
        "home": {"type": "string"},
        "sources": {"type": "array", "items": {"type": "string"}},
        "maintainers": {"type": "array", "items": {"$ref": "#/$defs/HelmMaintainer"}},
        "icon": {"type": "string"},
        "app_version": {"type": "string"},
        "deprecated": {"type": "boolean"},
        "annotations": {"type": "object", "additionalProperties": {"type": "string"}},
        "dependencies": {"type": "object", "additionalProperties": {"$ref": "#/$defs/HelmDependency"}},
        "renders": {"type": "object", "additionalProperties": {"$ref": "#/$defs/HelmRender"}}
      }
    },
    "HelmMaintainer": {
      "type": "object",
      "additionalProperties": false,
      "required": ["name"],
      "properties": {
        "name": {"type": "string", "minLength": 1},
        "email": {"type": "string", "minLength": 1},
        "url": {"type": "string", "minLength": 1}
      }
    }
  }
}
